{
  "accepted_count": 4,
  "kind": "downstream_consumption_test_vectors",
  "milestone": "M29",
  "rejected_count": 8,
  "schema": "frp.m29.downstream_consumption_test_vectors.v3.1.0",
  "source_commit": "a1c0bb2fa0a4731b9339e6cd996589e1bf226c04",
  "status": "PASS",
  "vector_count": 12,
  "vector_set_digest": "3057e2195ac07ee24aafdd644118629c929ee61f65e63e8dfad8ccf8741a4701",
  "vector_set_id": "frp-m29-published-byte-consumption-v1",
  "vectors": [
    {
      "expected_outcome": "accepted",
      "expected_reason": "SUPPORTED_EXACT_SOURCE_BYTES",
      "member_id": "m16-fpga-preparation-execution-trace",
      "observed_outcome": "accepted",
      "observed_reason": "SUPPORTED_EXACT_SOURCE_BYTES",
      "payload_source": "canonical_demo_package_member",
      "raw_sha256": "7d58b6741bdcadbfb9acb9049ed0e956305f49b9ad36946e719a4121b5caf22f",
      "schema_identifier": "frp.m16.fpga_preparation_execution_trace.v2.1.0",
      "status": "PASS",
      "vector_id": "accept-m16-fpga-preparation-execution-trace"
    },
    {
      "expected_outcome": "accepted",
      "expected_reason": "SUPPORTED_EXACT_SOURCE_BYTES",
      "member_id": "m27-telemetry-semantics",
      "observed_outcome": "accepted",
      "observed_reason": "SUPPORTED_EXACT_SOURCE_BYTES",
      "payload_source": "canonical_demo_package_member",
      "raw_sha256": "813ae5c66ceaddabc77734d44f1ebf971ca3bd7e11c1984e2e0c8f0204dfd1bc",
      "schema_identifier": "m27-telemetry-semantics-v2.9.0",
      "status": "PASS",
      "vector_id": "accept-m27-telemetry-semantics"
    },
    {
      "expected_outcome": "accepted",
      "expected_reason": "SUPPORTED_EXACT_SOURCE_BYTES",
      "member_id": "m28-trace-observatory-upstream-contract",
      "observed_outcome": "accepted",
      "observed_reason": "SUPPORTED_EXACT_SOURCE_BYTES",
      "payload_source": "canonical_demo_package_member",
      "raw_sha256": "556cd2921014d78184dad625438e053632c2650164f95787f39a6fc871b4a3f0",
      "schema_identifier": "frp.m28.trace_observatory_upstream_contract.v3.0.0",
      "status": "PASS",
      "vector_id": "accept-m28-trace-observatory-upstream-contract"
    },
    {
      "expected_outcome": "accepted",
      "expected_reason": "SUPPORTED_EXACT_SOURCE_BYTES",
      "member_id": "m28-hierarchical-scaling-contract",
      "observed_outcome": "accepted",
      "observed_reason": "SUPPORTED_EXACT_SOURCE_BYTES",
      "payload_source": "canonical_demo_package_member",
      "raw_sha256": "13f85ac82b63d0191157bd2cfa04dd37358ef66d8e69bdb96bb1892abb77dbae",
      "schema_identifier": "frp.m28.hierarchical_scaling_contract.v3.0.0",
      "status": "PASS",
      "vector_id": "accept-m28-hierarchical-scaling-contract"
    },
    {
      "expected_outcome": "rejected",
      "expected_reason": "UNKNOWN_ARTIFACT_IDENTIFIER",
      "member_id": "unknown-artifact",
      "observed_outcome": "rejected",
      "observed_reason": "UNKNOWN_ARTIFACT_IDENTIFIER",
      "payload_source": "canonical_demo_package_member",
      "raw_sha256": "7d58b6741bdcadbfb9acb9049ed0e956305f49b9ad36946e719a4121b5caf22f",
      "schema_identifier": "frp.m16.fpga_preparation_execution_trace.v2.1.0",
      "status": "PASS",
      "vector_id": "reject-unknown-artifact"
    },
    {
      "expected_outcome": "rejected",
      "expected_reason": "UNSUPPORTED_SCHEMA_IDENTIFIER",
      "member_id": "m16-fpga-preparation-execution-trace",
      "observed_outcome": "rejected",
      "observed_reason": "UNSUPPORTED_SCHEMA_IDENTIFIER",
      "payload_source": "canonical_demo_package_member",
      "raw_sha256": "7d58b6741bdcadbfb9acb9049ed0e956305f49b9ad36946e719a4121b5caf22f",
      "schema_identifier": "frp.unknown.schema.v9.0.0",
      "status": "PASS",
      "vector_id": "reject-unknown-schema"
    },
    {
      "expected_outcome": "rejected",
      "expected_reason": "UNSUPPORTED_SCHEMA_IDENTIFIER",
      "member_id": "m16-fpga-preparation-execution-trace",
      "observed_outcome": "rejected",
      "observed_reason": "UNSUPPORTED_SCHEMA_IDENTIFIER",
      "payload_source": "canonical_demo_package_member",
      "raw_sha256": "7d58b6741bdcadbfb9acb9049ed0e956305f49b9ad36946e719a4121b5caf22f",
      "schema_identifier": "frp.m16.fpga_preparation_execution_trace.v9.0.0",
      "status": "PASS",
      "vector_id": "reject-unsupported-version"
    },
    {
      "expected_outcome": "rejected",
      "expected_reason": "SCHEMA_ALIAS_FORBIDDEN",
      "member_id": "m16-fpga-preparation-execution-trace",
      "observed_outcome": "rejected",
      "observed_reason": "SCHEMA_ALIAS_FORBIDDEN",
      "payload_source": "canonical_demo_package_member",
      "raw_sha256": "7d58b6741bdcadbfb9acb9049ed0e956305f49b9ad36946e719a4121b5caf22f",
      "schema_alias": true,
      "schema_identifier": "frp.m16.fpga_preparation_execution_trace.v2.1.0",
      "status": "PASS",
      "vector_id": "reject-schema-alias"
    },
    {
      "expected_outcome": "rejected",
      "expected_reason": "INVALID_BASE64",
      "member_id": "m16-fpga-preparation-execution-trace",
      "observed_outcome": "rejected",
      "observed_reason": "INVALID_BASE64",
      "payload_base64": "not-base64",
      "payload_source": "canonical_demo_package_member",
      "raw_sha256": "7d58b6741bdcadbfb9acb9049ed0e956305f49b9ad36946e719a4121b5caf22f",
      "schema_identifier": "frp.m16.fpga_preparation_execution_trace.v2.1.0",
      "status": "PASS",
      "vector_id": "reject-invalid-base64"
    },
    {
      "expected_outcome": "rejected",
      "expected_reason": "SOURCE_DIGEST_MISMATCH",
      "member_id": "m16-fpga-preparation-execution-trace",
      "observed_outcome": "rejected",
      "observed_reason": "SOURCE_DIGEST_MISMATCH",
      "payload_mutation": "append_newline",
      "payload_source": "canonical_demo_package_member",
      "raw_sha256": "7d58b6741bdcadbfb9acb9049ed0e956305f49b9ad36946e719a4121b5caf22f",
      "schema_identifier": "frp.m16.fpga_preparation_execution_trace.v2.1.0",
      "status": "PASS",
      "vector_id": "reject-altered-source-bytes"
    },
    {
      "expected_outcome": "rejected",
      "expected_reason": "SOURCE_DIGEST_MISMATCH",
      "member_id": "m16-fpga-preparation-execution-trace",
      "observed_outcome": "rejected",
      "observed_reason": "SOURCE_DIGEST_MISMATCH",
      "payload_source": "canonical_demo_package_member",
      "raw_sha256": "0000000000000000000000000000000000000000000000000000000000000000",
      "schema_identifier": "frp.m16.fpga_preparation_execution_trace.v2.1.0",
      "status": "PASS",
      "vector_id": "reject-wrong-digest"
    },
    {
      "expected_outcome": "rejected",
      "expected_reason": "RELEASE_LABEL_NOT_IDENTITY_KEY",
      "identity_from_release_label": true,
      "member_id": "m16-fpga-preparation-execution-trace",
      "observed_outcome": "rejected",
      "observed_reason": "RELEASE_LABEL_NOT_IDENTITY_KEY",
      "payload_source": "canonical_demo_package_member",
      "raw_sha256": "7d58b6741bdcadbfb9acb9049ed0e956305f49b9ad36946e719a4121b5caf22f",
      "schema_identifier": "frp.m16.fpga_preparation_execution_trace.v2.1.0",
      "status": "PASS",
      "vector_id": "reject-release-label-identity"
    }
  ],
  "version": "3.1.0"
}
